<!ELEMENT departments (department+)>
<!ELEMENT department (title, hod, programs, focus)>
<!ELEMENT title (#PCDATA)>
<!ELEMENT hod (#PCDATA)>
<!ELEMENT programs (#PCDATA)>
<!ELEMENT focus (#PCDATA)>
